{
  "schema_version": 6,
  "task_id": "11111111-1111-4111-8111-111111111111",
  "session_id": "session-1",
  "run_id": "run-1",
  "offset": 0,
  "next_offset": null,
  "total_events": 8,
  "snapshot_revision": 17,
  "snapshot_at": 1200,
  "events": [
    {
      "type": "SESSION_APPROVED",
      "event_id": "session-approved:1",
      "recorded_at": 100,
      "task_id": "11111111-1111-4111-8111-111111111111",
      "run_id": "run-1",
      "workspace_root": "/workspace",
      "policy_hash": "sha256:0101010101010101010101010101010101010101010101010101010101010101",
      "expires_at": 2000
    },
    {
      "type": "SESSION_REVOKED",
      "event_id": "session-revoked:1",
      "recorded_at": 110,
      "task_id": "11111111-1111-4111-8111-111111111111",
      "run_id": "run-1",
      "revocation_digest": "sha256:0202020202020202020202020202020202020202020202020202020202020202"
    },
    {
      "type": "ACTION_DECISION",
      "event_id": "action-decision:1",
      "recorded_at": 120,
      "approval_id": "22222222-2222-4222-8222-222222222222",
      "tool_call_id": "call-1",
      "proposal_digest": "sha256:0303030303030303030303030303030303030303030303030303030303030303",
      "decision": "APPROVED",
      "evidence_hash": "sha256:0404040404040404040404040404040404040404040404040404040404040404",
      "consumed": true
    },
    {
      "type": "ACTION_STARTED",
      "event_id": "action-started:1",
      "recorded_at": 130,
      "authorization_id": "33333333-3333-4333-8333-333333333333",
      "tool_call_id": "call-1",
      "extension_id": "developer",
      "tool_name": "read",
      "proposal_digest": "sha256:0505050505050505050505050505050505050505050505050505050505050505",
      "request_hash": "sha256:0606060606060606060606060606060606060606060606060606060606060606",
      "conformance_evaluation_hashes": [
        "sha256:0707070707070707070707070707070707070707070707070707070707070707"
      ],
      "task_scope_status": "WITHIN_APPROVED_ACCESS",
      "review_status": "NOT_REQUIRED",
      "decision_reason_code": "POLICY_CONFORMANT",
      "task_control_hash": "sha256:0808080808080808080808080808080808080808080808080808080808080808",
      "task_control_provenance": "DECISION_BOUND",
      "intent_evaluation_hash": "sha256:0a0a0a0a0a0a0a0a0a0a0a0a0a0a0a0a0a0a0a0a0a0a0a0a0a0a0a0a0a0a0a0a",
      "intent_assessment": {
        "schema_version": 1,
        "profile": "PRE_EXECUTION",
        "status": "REVIEW_REQUIRED",
        "evidence_count": 0,
        "finding_reasons": ["MISSING_EVIDENCE"]
      }
    },
    {
      "type": "ACTION_COMPLETED",
      "event_id": "action-completed:1",
      "recorded_at": 140,
      "authorization_id": "33333333-3333-4333-8333-333333333333",
      "tool_call_id": "call-1",
      "outcome": "SUCCEEDED",
      "state": "SUCCEEDED",
      "record_hash": "sha256:0707070707070707070707070707070707070707070707070707070707070707",
      "execution_lineage_hash": "sha256:0808080808080808080808080808080808080808080808080808080808080808",
      "task_scope_status": "WITHIN_APPROVED_ACCESS",
      "review_status": "NOT_REQUIRED",
      "decision_reason_code": "POLICY_CONFORMANT",
      "task_control_hash": "sha256:0909090909090909090909090909090909090909090909090909090909090909",
      "task_control_provenance": "LINEAGE_BOUND",
      "intent_pre_evaluation_hash": "sha256:0a0a0a0a0a0a0a0a0a0a0a0a0a0a0a0a0a0a0a0a0a0a0a0a0a0a0a0a0a0a0a0a",
      "intent_complete_evaluation_hash": "sha256:0b0b0b0b0b0b0b0b0b0b0b0b0b0b0b0b0b0b0b0b0b0b0b0b0b0b0b0b0b0b0b0b",
      "intent_pre_assessment": {
        "schema_version": 1,
        "profile": "PRE_EXECUTION",
        "status": "REVIEW_REQUIRED",
        "evidence_count": 0,
        "finding_reasons": ["MISSING_EVIDENCE"]
      },
      "intent_complete_assessment": {
        "schema_version": 1,
        "profile": "COMPLETE_TRACE",
        "status": "REVIEW_REQUIRED",
        "evidence_count": 0,
        "finding_reasons": ["MISSING_EVIDENCE"]
      }
    },
    {
      "type": "ACTION_DENIED",
      "event_id": "action-denied:1",
      "recorded_at": 150,
      "denial_id": 1,
      "attempted_run_id": "run-1",
      "tool_call_id": "call-2",
      "proposal_digest": "sha256:0a0a0a0a0a0a0a0a0a0a0a0a0a0a0a0a0a0a0a0a0a0a0a0a0a0a0a0a0a0a0a0a",
      "reason_code": "CAPABILITY_NOT_APPROVED"
    },
    {
      "type": "RESTORE_PREPARED",
      "event_id": "restore-prepared:1",
      "recorded_at": 160,
      "restore_id": "44444444-4444-4444-8444-444444444444",
      "recovery_id": "55555555-5555-4555-8555-555555555555",
      "relative_path": "notes.txt",
      "content_hash": "sha256:0b0b0b0b0b0b0b0b0b0b0b0b0b0b0b0b0b0b0b0b0b0b0b0b0b0b0b0b0b0b0b0b"
    },
    {
      "type": "RESTORE_COMPLETED",
      "event_id": "restore-completed:1",
      "recorded_at": 170,
      "restore_id": "44444444-4444-4444-8444-444444444444",
      "recovery_id": "55555555-5555-4555-8555-555555555555",
      "relative_path": "notes.txt",
      "record_hash": "sha256:0c0c0c0c0c0c0c0c0c0c0c0c0c0c0c0c0c0c0c0c0c0c0c0c0c0c0c0c0c0c0c0c"
    }
  ],
  "page_digest": "sha256:0d0d0d0d0d0d0d0d0d0d0d0d0d0d0d0d0d0d0d0d0d0d0d0d0d0d0d0d0d0d0d0d"
}
